{
  "schema_version": 1,
  "update_key": "aese.genesis.active-session-no-reprovision.2026-07-30",
  "node_key": "aese.world.genesis",
  "update_type": "implementation",
  "summary": "阻止旧企业 session 刷新重复 Provisioning",
  "detail": "AESE loopback adapter 对 existing active tenant 只执行 Founder login 并返回 session，不再重复 identity bootstrap、M9 Runtime install 或 tenant activate；登录失败时 fail closed。",
  "status_after": "completed",
  "progress_after": 100,
  "current_state": "无 Player Token 的本地旧企业继续游戏不会改写既有身份、Runtime 或业务过程。",
  "evidence_ref": "docs/designs/DES-029-genesis-zero-start-and-ai-identity.md",
  "occurred_at": "2026-07-30T11:40:00Z"
}
