{
  "schema_version": 1,
  "update_key": "aese.finance.navigation-semantic-assets.2026-07-30",
  "node_key": "aese.world.genesis",
  "update_type": "implementation",
  "summary": "拆分财务工作台并发布多组织与共享主数据语义资产",
  "detail": "IAOS Runtime 2.3.0 将财务账务与报表收敛为查询输出，新增组织待办、多组织共享、账簿基础、客户、供应商和产品独立入口；F5B-F5D 的 16 类权威模型发布为 Semantic/Entity 资产，并由受治理 Capability 同事务维护只读 Entity 投影。",
  "status_after": "completed",
  "progress_after": 82,
  "current_state": "F5D2 complete; module period control and M10-M13 operational subledgers remain planned",
  "evidence_ref": "docs/designs/finance/DES-031-multi-organization-and-shared-master-data-foundation.md",
  "commit_sha": "046245e",
  "occurred_at": "2026-07-30T11:45:00Z"
}
