{
  "schema_version": 1,
  "update_key": "aese.m9.atomic-capability-contract.2026-07-31",
  "node_key": "aese.world.genesis",
  "update_type": "status",
  "summary": "M9 接入 IAOS 单一可执行原子能力目录",
  "detail": "AESE M9 的 Agent、Process 和 World Bridge 继续调用 Business Capability；底层复用 IAOS DES-076 的 19 项真实原子能力，不复制 Handler，也不把审批、过账等完整动作误分类为原子能力。",
  "status_after": "completed",
  "progress_after": 100,
  "current_state": "M9 跨仓能力层级与执行边界已固定；IAOS main 67fe3d2 已部署，目录 API 返回 18 active 和 1 deprecated。",
  "evidence_ref": "docs/plans/2026-07-23-m9-iaos-native-incorporation-closed-loop.md",
  "commit_sha": "67fe3d2",
  "occurred_at": "2026-07-31T10:25:00Z"
}
