{
  "schema_version": 1,
  "update_key": "aese-20260723-m9-native-contract-evidence-v1",
  "node_key": "aese.world.genesis",
  "update_type": "test",
  "summary": "M9N 双仓合同兼容与离线 Evidence Bundle",
  "detail": "双仓有效/破损 fixtures fail-closed；terminal evidence 包含 version/hash/稳定引用并通过独立 IAOS verifier。",
  "status_after": "validating",
  "progress_after": 94,
  "current_state": "合同与证据门已关闭；继续授权、隔离与恢复矩阵。",
  "evidence_ref": "internal/worldcontract/m9_compatibility_test.go",
  "occurred_at": "2026-07-23T06:50:00Z"
}
