{
  "schema_version": 1,
  "update_key": "aese.genesis.organization-location-unlock.2026-07-28",
  "node_key": "aese.enterprise-genesis.zero-start",
  "update_type": "implementation",
  "summary": "修复初始组织节点无法进入企业总部",
  "detail": "资本核验完成后 Projection 立即进入人才治理章节并开放企业总部，使 organization.establish 的剧情入口与地点状态一致；Go 与浏览器测试覆盖章节边界。",
  "status_after": "validating",
  "progress_after": 96,
  "current_state": "organization mission destination is unlocked and its governed action panel is reachable",
  "evidence_ref": "internal/gameprojection/iaos_test.go",
  "occurred_at": "2026-07-28T13:38:00Z"
}
