{
  "schema_version": 1,
  "update_key": "aese-20260723-m9-native-runtime-rollback-v1",
  "node_key": "aese.world.genesis",
  "update_type": "implementation",
  "summary": "M9N Runtime Artifact 版本升级与安全回退边界",
  "detail": "IAOS Artifact/Compiler 1.1.0 保留旧 revision，支持 dry-run/apply/no-op/rollback；不兼容回退后业务命令 stale fail-closed。",
  "status_after": "validating",
  "progress_after": 92,
  "current_state": "Runtime 发布治理完成；继续 tenant 隔离、恢复和最终回归。",
  "evidence_ref": "docs/plans/2026-07-23-m9-iaos-native-incorporation-closed-loop.md",
  "occurred_at": "2026-07-23T06:15:00Z"
}
