{
  "schema_version": 1,
  "update_key": "aese-20260724-m9-work-item-process-alignment-v1",
  "node_key": "aese.m9.genesis-incorporation",
  "update_type": "implementation",
  "summary": "M9 工作项与正式流程顺序对齐",
  "detail": "Runtime 1.3.7 补回决议准备、登记材料校验和预算准备三个无状态工作项，开户后先执行 founder.resolution.prepare，再进入 G1 approve。",
  "status_after": "validating",
  "progress_after": 98,
  "current_state": "HCTM-TEST001 在线步骤 2 为 prepare/ready，步骤 3 为 approve/locked。",
  "evidence_ref": "docs/designs/DES-027-m9-iaos-native-incorporation-closed-loop.md",
  "occurred_at": "2026-07-24T07:20:00Z"
}
